[
  {
    "id": "core_world",
    "name_key": "origin.core_world.name",
    "description_key": "origin.core_world.description",
    "skill_bonuses": [
      { "id": "cybernetics", "amount": 2 },
      { "id": "blat", "amount": 1 }
    ]
  },
  {
    "id": "belt_colony",
    "name_key": "origin.belt_colony.name",
    "description_key": "origin.belt_colony.description",
    "skill_bonuses": [
      { "id": "mining", "amount": 2 },
      { "id": "engineering", "amount": 1 }
    ]
  },
  {
    "id": "orbital_station",
    "name_key": "origin.orbital_station.name",
    "description_key": "origin.orbital_station.description",
    "skill_bonuses": [
      { "id": "engineering", "amount": 2 },
      { "id": "navigation", "amount": 1 }
    ]
  },
  {
    "id": "frontier",
    "name_key": "origin.frontier.name",
    "description_key": "origin.frontier.description",
    "skill_bonuses": [
      { "id": "construction", "amount": 1 },
      { "id": "mining", "amount": 1 },
      { "id": "medicine", "amount": 1 }
    ]
  },
  {
    "id": "transport_fleet",
    "name_key": "origin.transport_fleet.name",
    "description_key": "origin.transport_fleet.description",
    "skill_bonuses": [
      { "id": "cosmonautics", "amount": 2 },
      { "id": "blat", "amount": 1 }
    ]
  },
  {
    "id": "research_outpost",
    "name_key": "origin.research_outpost.name",
    "description_key": "origin.research_outpost.description",
    "skill_bonuses": [
      { "id": "research", "amount": 2 },
      { "id": "cybernetics", "amount": 1 }
    ]
  },
  {
    "id": "civilian",
    "name_key": "origin.civilian.name",
    "description_key": "origin.civilian.description",
    "skill_bonuses": []
  }
]
